root@lamp-ubuntu-s-1vcpu-1gb-tor1-01:~# tcpdump -i eth0 tcp
17:04:05.069126 IP 167.99.180.39.ssh > cpeac202e733573-cmac202e733570.cpe.net.cable.rogers.com.51193: Flags [P.], seq 1474212:1474416, ack 181, win 501, length 204
17:04:05.069191 IP 167.99.180.39.ssh > cpeac202e733573-cmac202e733570.cpe.net.cable.rogers.com.51193: Flags [P.], seq 1474416:1474620, ack 181, win 501, length 204
17:04:05.069247 IP 167.99.180.39.ssh > cpeac202e733573-cmac202e733570.cpe.net.cable.rogers.com.51193: Flags [P.], seq 1474620:1474824, ack 181, win 501, length 204
17:04:05.069310 IP 167.99.180.39.ssh > cpeac202e733573-cmac202e733570.cpe.net.cable.rogers.com.51193: Flags [P.], seq 1474824:1475028, ack 181, win 501, length 204
17:04:05.069365 IP 167.99.180.39.ssh > cpeac202e733573-cmac202e733570.cpe.net.cable.rogers.com.51193: Flags [P.], seq 1475028:1475232, ack 181, win 501, length 204
17:04:05.069419 IP 167.99.180.39.ssh > cpeac202e733573-cmac202e733570.cpe.net.cable.rogers.com.51193: Flags [P.], seq 1475232:1475436, ack 181, win 501, length 204
17:04:05.069474 IP 167.99.180.39.ssh > cpeac202e733573-cmac202e733570.cpe.net.cable.rogers.com.51193: Flags [P.], seq 1475436:1475640, ack 181, win 501, length 204
17:04:05.069531 IP 167.99.180.39.ssh > cpeac202e733573-cmac202e733570.cpe.net.cable.rogers.com.51193: Flags [P.], seq 1475640:1475844, ack 181, win 501, length 204
17:04:05.069585 IP 167.99.180.39.ssh > cpeac202e733573-cmac202e733570.cpe.net.cable.rogers.com.51193: Flags [P.], seq 1475844:1476048, ack 181, win 501, length 204
17:04:05.069639 IP 167.99.180.39.ssh > cpeac202e733573-cmac202e733570.cpe.net.cable.rogers.com.51193: Flags [P.], seq 1476048:1476252, ack 181, win 501, length 204
17:04:05.069694 IP 167.99.180.39.ssh > cpeac202e733573-cmac202e733570.cpe.net.cable.rogers.com.51193: Flags [P.], seq 1476252:1476456, ack 181, win 501, length 204
17:04:05.069750 IP 167.99.180.39.ssh > cpeac202e733573-cmac202e733570.cpe.net.cable.rogers.com.51193: Flags [P.], seq 1476456:1476660, ack 181, win 501, length 204
17:04:05.069819 IP 167.99.180.39.ssh > cpeac202e733573-cmac202e733570.cpe.net.cable.rogers.com.51193: Flags [P.], seq 1476660:1476864, ack 181, win 501, length 204
17:04:05.069882 IP 167.99.180.39.ssh > cpeac202e733573-cmac202e733570.cpe.net.cable.rogers.com.51193: Flags [P.], seq 1476864:1477068, ack 181, win 501, length 204
17:04:05.069938 IP 167.99.180.39.ssh > cpeac202e733573-cmac202e733570.cpe.net.cable.rogers.com.51193: Flags [P.], seq 1477068:1477272, ack 181, win 501, length 204
17:04:05.070011 IP 167.99.180.39.ssh > cpeac202e733573-cmac202e733570.cpe.net.cable.rogers.com.51193: Flags [P.], seq 1477272:1477476, ack 181, win 501, length 204
17:04:05.070084 IP 167.99.180.39.ssh > cpeac202e733573-cmac202e733570.cpe.net.cable.rogers.com.51193: Flags [P.], seq 1477476:1477680, ack 181, win 501, length 204
17:04:05.070155 IP 167.99.180.39.ssh > cpeac202e733573-cmac202e733570.cpe.net.cable.rogers.com.51193: Flags [P.], seq 1477680:1477884, ack 181, win 501, length 204
17:04:05.070216 IP 167.99.180.39.ssh > cpeac202e733573-cmac202e733570.cpe.net.cable.rogers.com.51193: Flags [P.], seq 1477884:1478088, ack 181, win 501, length 204
17:04:05.070271 IP 167.99.180.39.ssh > cpeac202e733573-cmac202e733570.cpe.net.cable.rogers.com.51193: Flags [P.], seq 1478088:1478292, ack 181, win 501, length 204
17:04:05.070326 IP 167.99.180.39.ssh > cpeac202e733573-cmac202e733570.cpe.net.cable.rogers.com.51193: Flags [P.], seq 1478292:1478496, ack 181, win 501, length 204
17:04:05.070383 IP 167.99.180.39.ssh > cpeac202e733573-cmac202e733570.cpe.net.cable.rogers.com.51193: Flags [P.], seq 1478496:1478700, ack 181, win 501, length 204
17:04:05.070438 IP 167.99.180.39.ssh > cpeac202e733573-cmac202e733570.cpe.net.cable.rogers.com.51193: Flags [P.], seq 1478700:1478904, ack 181, win 501, length 204
17:04:05.070495 IP 167.99.180.39.ssh > cpeac202e733573-cmac202e733570.cpe.net.cable.rogers.com.51193: Flags [P.], seq 1478904:1479108, ack 181, win 501, length 204
17:04:05.070550 IP 167.99.180.39.ssh > cpeac202e733573-cmac202e733570.cpe.net.cable.rogers.com.51193: Flags [P.], seq 1479108:1479312, ack 181, win 501, length 204
17:04:05.070607 IP 167.99.180.39.ssh > cpeac202e733573-cmac202e733570.cpe.net.cable.rogers.com.51193: Flags [P.], seq 1479312:1479516, ack 181, win 501, length 204
17:04:05.070663 IP 167.99.180.39.ssh > cpeac202e733573-cmac202e733570.cpe.net.cable.rogers.com.51193: Flags [P.], seq 1479516:1479720, ack 181, win 501, length 204
17:04:05.070734 IP 167.99.180.39.ssh > cpeac202e733573-cmac202e733570.cpe.net.cable.rogers.com.51193: Flags [P.], seq 1479720:1479924, ack 181, win 501, length 204
17:04:05.070794 IP 167.99.180.39.ssh > cpeac202e733573-cmac202e733570.cpe.net.cable.rogers.com.51193: Flags [P.], seq 1479924:1480128, ack 181, win 501, length 204
17:04:05.070849 IP 167.99.180.39.ssh > cpeac202e733573-cmac202e733570.cpe.net.cable.rogers.com.51193: Flags [P.], seq 1480128:1480332, ack 181, win 501, length 204
17:04:05.070905 IP 167.99.180.39.ssh > cpeac202e733573-cmac202e733570.cpe.net.cable.rogers.com.51193: Flags [P.], seq 1480332:1480536, ack 181, win 501, length 204
17:04:05.070964 IP 167.99.180.39.ssh > cpeac202e733573-cmac202e733570.cpe.net.cable.rogers.com.51193: Flags [P.], seq 1480536:1480740, ack 181, win 501, length 204
17:04:05.071019 IP 167.99.180.39.ssh > cpeac202e733573-cmac202e733570.cpe.net.cable.rogers.com.51193: Flags [P.], seq 1480740:1480944, ack 181, win 501, length 204
17:04:05.071076 IP 167.99.180.39.ssh > cpeac202e733573-cmac202e733570.cpe.net.cable.rogers.com.51193: Flags [P.], seq 1480944:1481148, ack 181, win 501, length 204
17:04:05.071130 IP 167.99.180.39.ssh > cpeac202e733573-cmac202e733570.cpe.net.cable.rogers.com.51193: Flags [P.], seq 1481148:1481352, ack 181, win 501, length 204
17:04:05.071185 IP 167.99.180.39.ssh > cpeac202e733573-cmac202e733570.cpe.net.cable.rogers.com.51193: Flags [P.], seq 1481352:1481556, ack 181, win 501, length 204
17:04:05.071243 IP 167.99.180.39.ssh > cpeac202e733573-cmac202e733570.cpe.net.cable.rogers.com.51193: Flags [P.], seq 1481556:1481760, ack 181, win 501, length 204
17:04:05.071302 IP 167.99.180.39.ssh > cpeac202e733573-cmac202e733570.cpe.net.cable.rogers.com.51193: Flags [P.], seq 1481760:1481964, ack 181, win 501, length 204
17:04:05.071356 IP 167.99.180.39.ssh > cpeac202e733573-cmac202e733570.cpe.net.cable.rogers.com.51193: Flags [P.], seq 1481964:1482168, ack 181, win 501, length 204
17:04:05.071414 IP 167.99.180.39.ssh > cpeac202e733573-cmac202e733570.cpe.net.cable.rogers.com.51193: Flags [P.], seq 1482168:1482372, ack 181, win 501, length 204
17:04:05.071469 IP 167.99.180.39.ssh > cpeac202e733573-cmac202e733570.cpe.net.cable.rogers.com.51193: Flags [P.], seq 1482372:1482576, ack 181, win 501, length 204
17:04:05.071535 IP 167.99.180.39.ssh > cpeac202e733573-cmac202e733570.cpe.net.cable.rogers.com.51193: Flags [P.], seq 1482576:1482780, ack 181, win 501, length 204
17:04:05.071596 IP 167.99.180.39.ssh > cpeac202e733573-cmac202e733570.cpe.net.cable.rogers.com.51193: Flags [P.], seq 1482780:1482984, ack 181, win 501, length 204
17:04:05.071653 IP 167.99.180.39.ssh > cpeac202e733573-cmac202e733570.cpe.net.cable.rogers.com.51193: Flags [P.], seq 1482984:1483188, ack 181, win 501, length 204
17:04:05.071709 IP 167.99.180.39.ssh > cpeac202e733573-cmac202e733570.cpe.net.cable.rogers.com.51193: Flags [P.], seq 1483188:1483392, ack 181, win 501, length 204
17:04:05.071765 IP 167.99.180.39.ssh > cpeac202e733573-cmac202e733570.cpe.net.cable.rogers.com.51193: Flags [P.], seq 1483392:1483596, ack 181, win 501, length 204
17:04:05.071820 IP 167.99.180.39.ssh > cpeac202e733573-cmac202e733570.cpe.net.cable.rogers.com.51193: Flags [P.], seq 1483596:1483800, ack 181, win 501, length 204
17:04:05.071904 IP 167.99.180.39.ssh > cpeac202e733573-cmac202e733570.cpe.net.cable.rogers.com.51193: Flags [P.], seq 1483800:1484004, ack 181, win 501, length 204
17:04:05.071970 IP 167.99.180.39.ssh > cpeac202e733573-cmac202e733570.cpe.net.cable.rogers.com.51193: Flags [P.], seq 1484004:1484208, ack 181, win 501, length 204
17:04:05.072033 IP 167.99.180.39.ssh > cpeac202e733573-cmac202e733570.cpe.net.cable.rogers.com.51193: Flags [P.], seq 1484208:1484412, ack 181, win 501, length 204
17:04:05.072094 IP 167.99.180.39.ssh > cpeac202e733573-cmac202e733570.cpe.net.cable.rogers.com.51193: Flags [P.], seq 1484412:1484616, ack 181, win 501, length 204
17:04:05.072158 IP 167.99.180.39.ssh > cpeac202e733573-cmac202e733570.cpe.net.cable.rogers.com.51193: Flags [P.], seq 1484616:1484820, ack 181, win 501, length 204
17:04:05.072218 IP 167.99.180.39.ssh > cpeac202e733573-cmac202e733570.cpe.net.cable.rogers.com.51193: Flags [P.], seq 1484820:1485024, ack 181, win 501, length 204
17:04:05.072285 IP 167.99.180.39.ssh > cpeac202e733573-cmac202e733570.cpe.net.cable.rogers.com.51193: Flags [P.], seq 1485024:1485228, ack 181, win 501, length 204
17:04:05.072341 IP 167.99.180.39.ssh > cpeac202e733573-cmac202e733570.cpe.net.cable.rogers.com.51193: Flags [P.], seq 1485228:1485432, ack 181, win 501, length 204
17:04:05.072398 IP 167.99.180.39.ssh > cpeac202e733573-cmac202e733570.cpe.net.cable.rogers.com.51193: Flags [P.], seq 1485432:1485636, ack 181, win 501, length 204
17:04:05.072452 IP 167.99.180.39.ssh > cpeac202e733573-cmac202e733570.cpe.net.cable.rogers.com.51193: Flags [P.], seq 1485636:1485840, ack 181, win 501, length 204
17:04:05.072511 IP 167.99.180.39.ssh > cpeac202e733573-cmac202e733570.cpe.net.cable.rogers.com.51193: Flags [P.], seq 1485840:1486044, ack 181, win 501, length 204
17:04:05.072565 IP 167.99.180.39.ssh > cpeac202e733573-cmac202e733570.cpe.net.cable.rogers.com.51193: Flags [P.], seq 1486044:1486248, ack 181, win 501, length 204
17:04:05.072624 IP 167.99.180.39.ssh > cpeac202e733573-cmac202e733570.cpe.net.cable.rogers.com.51193: Flags [P.], seq 1486248:1486452, ack 181, win 501, length 204
17:04:05.072679 IP 167.99.180.39.ssh > cpeac202e733573-cmac202e733570.cpe.net.cable.rogers.com.51193: Flags [P.], seq 1486452:1486656, ack 181, win 501, length 204
17:04:05.072734 IP 167.99.180.39.ssh > cpeac202e733573-cmac202e733570.cpe.net.cable.rogers.com.51193: Flags [P.], seq 1486656:1486860, ack 181, win 501, length 204
17:04:05.072800 IP 167.99.180.39.ssh > cpeac202e733573-cmac202e733570.cpe.net.cable.rogers.com.51193: Flags [P.], seq 1486860:1487064, ack 181, win 501, length 204
17:04:05.072870 IP cpeac202e733573-cmac202e733570.cpe.net.cable.rogers.com.51193 > 167.99.180.39.ssh: Flags [.], ack 1439336, win 1129, length 0
17:04:05.072893 IP cpeac202e733573-cmac202e733570.cpe.net.cable.rogers.com.51193 > 167.99.180.39.ssh: Flags [.], ack 1441136, win 1122, length 0
17:04:05.072900 IP cpeac202e733573-cmac202e733570.cpe.net.cable.rogers.com.51193 > 167.99.180.39.ssh: Flags [.], ack 1441748, win 1120, length 0
17:04:05.072905 IP cpeac202e733573-cmac202e733570.cpe.net.cable.rogers.com.51193 > 167.99.180.39.ssh: Flags [.], ack 1445012, win 1107, length 0
17:04:05.072913 IP cpeac202e733573-cmac202e733570.cpe.net.cable.rogers.com.51193 > 167.99.180.39.ssh: Flags [.], ack 1446848, win 1100, length 0
17:04:05.072919 IP cpeac202e733573-cmac202e733570.cpe.net.cable.rogers.com.51193 > 167.99.180.39.ssh: Flags [.], ack 1447460, win 1097, length 0
17:04:05.072925 IP cpeac202e733573-cmac202e733570.cpe.net.cable.rogers.com.51193 > 167.99.180.39.ssh: Flags [.], ack 1454804, win 1069, length 0
17:04:05.072943 IP cpeac202e733573-cmac202e733570.cpe.net.cable.rogers.com.51193 > 167.99.180.39.ssh: Flags [.], ack 1456696, win 1061, length 0
17:04:05.073147 IP 167.99.180.39.ssh > cpeac202e733573-cmac202e733570.cpe.net.cable.rogers.com.51193: Flags [P.], seq 1487064:1488436, ack 181, win 501, length 1372
17:04:05.073220 IP 167.99.180.39.ssh > cpeac202e733573-cmac202e733570.cpe.net.cable.rogers.com.51193: Flags [P.], seq 1488436:1488640, ack 181, win 501, length 204
17:04:05.073293 IP 167.99.180.39.ssh > cpeac202e733573-cmac202e733570.cpe.net.cable.rogers.com.51193: Flags [P.], seq 1488640:1488844, ack 181, win 501, length 204
17:04:05.073370 IP 167.99.180.39.ssh > cpeac202e733573-cmac202e733570.cpe.net.cable.rogers.com.51193: Flags [P.], seq 1488844:1489048, ack 181, win 501, length 204
17:04:05.073432 IP 167.99.180.39.ssh > cpeac202e733573-cmac202e733570.cpe.net.cable.rogers.com.51193: Flags [P.], seq 1489048:1489252, ack 181, win 501, length 204
17:04:05.073491 IP 167.99.180.39.ssh > cpeac202e733573-cmac202e733570.cpe.net.cable.rogers.com.51193: Flags [P.], seq 1489252:1489456, ack 181, win 501, length 204
17:04:05.073558 IP 167.99.180.39.ssh > cpeac202e733573-cmac202e733570.cpe.net.cable.rogers.com.51193: Flags [P.], seq 1489456:1489660, ack 181, win 501, length 204
17:04:05.073618 IP 167.99.180.39.ssh > cpeac202e733573-cmac202e733570.cpe.net.cable.rogers.com.51193: Flags [P.], seq 1489660:1489864, ack 181, win 501, length 204
17:04:05.073673 IP 167.99.180.39.ssh > cpeac202e733573-cmac202e733570.cpe.net.cable.rogers.com.51193: Flags [P.], seq 1489864:1490068, ack 181, win 501, length 204
17:04:05.073738 IP 167.99.180.39.ssh > cpeac202e733573-cmac202e733570.cpe.net.cable.rogers.com.51193: Flags [P.], seq 1490068:1490272, ack 181, win 501, length 204
17:04:05.073797 IP 167.99.180.39.ssh > cpeac202e733573-cmac202e733570.cpe.net.cable.rogers.com.51193: Flags [P.], seq 1490272:1490476, ack 181, win 501, length 204
17:04:05.073852 IP 167.99.180.39.ssh > cpeac202e733573-cmac202e733570.cpe.net.cable.rogers.com.51193: Flags [P.], seq 1490476:1490680, ack 181, win 501, length 204
17:04:05.073906 IP 167.99.180.39.ssh > cpeac202e733573-cmac202e733570.cpe.net.cable.rogers.com.51193: Flags [P.], seq 1490680:1490884, ack 181, win 501, length 204
17:04:05.073960 IP 167.99.180.39.ssh > cpeac202e733573-cmac202e733570.cpe.net.cable.rogers.com.51193: Flags [P.], seq 1490884:1491088, ack 181, win 501, length 204
17:04:05.074017 IP 167.99.180.39.ssh > cpeac202e733573-cmac202e733570.cpe.net.cable.rogers.com.51193: Flags [P.], seq 1491088:1491292, ack 181, win 501, length 204
17:04:05.074080 IP 167.99.180.39.ssh > cpeac202e733573-cmac202e733570.cpe.net.cable.rogers.com.51193: Flags [P.], seq 1491292:1491496, ack 181, win 501, length 204
17:04:05.074150 IP 167.99.180.39.ssh > cpeac202e733573-cmac202e733570.cpe.net.cable.rogers.com.51193: Flags [P.], seq 1491496:1491700, ack 181, win 501, length 204
17:04:05.074207 IP 167.99.180.39.ssh > cpeac202e733573-cmac202e733570.cpe.net.cable.rogers.com.51193: Flags [P.], seq 1491700:1491904, ack 181, win 501, length 204
17:04:05.074262 IP 167.99.180.39.ssh > cpeac202e733573-cmac202e733570.cpe.net.cable.rogers.com.51193: Flags [P.], seq 1491904:1492108, ack 181, win 501, length 204
17:04:05.074320 IP 167.99.180.39.ssh > cpeac202e733573-cmac202e733570.cpe.net.cable.rogers.com.51193: Flags [P.], seq 1492108:1492312, ack 181, win 501, length 204
17:04:05.074374 IP 167.99.180.39.ssh > cpeac202e733573-cmac202e733570.cpe.net.cable.rogers.com.51193: Flags [P.], seq 1492312:1492516, ack 181, win 501, length 204
17:04:05.074436 IP 167.99.180.39.ssh > cpeac202e733573-cmac202e733570.cpe.net.cable.rogers.com.51193: Flags [P.], seq 1492516:1492720, ack 181, win 501, length 204
17:04:05.074543 IP 167.99.180.39.ssh > cpeac202e733573-cmac202e733570.cpe.net.cable.rogers.com.51193: Flags [P.], seq 1492720:1492924, ack 181, win 501, length 204
17:04:05.074652 IP 167.99.180.39.ssh > cpeac202e733573-cmac202e733570.cpe.net.cable.rogers.com.51193: Flags [P.], seq 1492924:1493128, ack 181, win 501, length 204
17:04:05.074742 IP 167.99.180.39.ssh > cpeac202e733573-cmac202e733570.cpe.net.cable.rogers.com.51193: Flags [P.], seq 1493128:1493332, ack 181, win 501, length 204
17:04:05.074800 IP 167.99.180.39.ssh > cpeac202e733573-cmac202e733570.cpe.net.cable.rogers.com.51193: Flags [P.], seq 1493332:1493536, ack 181, win 501, length 204
17:04:05.074856 IP 167.99.180.39.ssh > cpeac202e733573-cmac202e733570.cpe.net.cable.rogers.com.51193: Flags [P.], seq 1493536:1493740, ack 181, win 501, length 204
17:04:05.074914 IP 167.99.180.39.ssh > cpeac202e733573-cmac202e733570.cpe.net.cable.rogers.com.51193: Flags [P.], seq 1493740:1493944, ack 181, win 501, length 204
17:04:05.075015 IP 167.99.180.39.ssh > cpeac202e733573-cmac202e733570.cpe.net.cable.rogers.com.51193: Flags [P.], seq 1493944:1494148, ack 181, win 501, length 204
17:04:05.075086 IP 167.99.180.39.ssh > cpeac202e733573-cmac202e733570.cpe.net.cable.rogers.com.51193: Flags [P.], seq 1494148:1494352, ack 181, win 501, length 204
17:04:05.075143 IP 167.99.180.39.ssh > cpeac202e733573-cmac202e733570.cpe.net.cable.rogers.com.51193: Flags [P.], seq 1494352:1494556, ack 181, win 501, length 204
17:04:05.075211 IP 167.99.180.39.ssh > cpeac202e733573-cmac202e733570.cpe.net.cable.rogers.com.51193: Flags [P.], seq 1494556:1494760, ack 181, win 501, length 204
17:04:05.075266 IP 167.99.180.39.ssh > cpeac202e733573-cmac202e733570.cpe.net.cable.rogers.com.51193: Flags [P.], seq 1494760:1494964, ack 181, win 501, length 204
17:04:05.075321 IP 167.99.180.39.ssh > cpeac202e733573-cmac202e733570.cpe.net.cable.rogers.com.51193: Flags [P.], seq 1494964:1495168, ack 181, win 501, length 204
17:04:05.075376 IP 167.99.180.39.ssh > cpeac202e733573-cmac202e733570.cpe.net.cable.rogers.com.51193: Flags [P.], seq 1495168:1495372, ack 181, win 501, length 204
17:04:05.075432 IP 167.99.180.39.ssh > cpeac202e733573-cmac202e733570.cpe.net.cable.rogers.com.51193: Flags [P.], seq 1495372:1495576, ack 181, win 501, length 204
17:04:05.075486 IP 167.99.180.39.ssh > cpeac202e733573-cmac202e733570.cpe.net.cable.rogers.com.51193: Flags [P.], seq 1495576:1495780, ack 181, win 501, length 204
17:04:05.075540 IP 167.99.180.39.ssh > cpeac202e733573-cmac202e733570.cpe.net.cable.rogers.com.51193: Flags [P.], seq 1495780:1495984, ack 181, win 501, length 204
17:04:05.075598 IP 167.99.180.39.ssh > cpeac202e733573-cmac202e733570.cpe.net.cable.rogers.com.51193: Flags [P.], seq 1495984:1496188, ack 181, win 501, length 204
17:04:05.075652 IP 167.99.180.39.ssh > cpeac202e733573-cmac202e733570.cpe.net.cable.rogers.com.51193: Flags [P.], seq 1496188:1496392, ack 181, win 501, length 204
17:04:05.075705 IP 167.99.180.39.ssh > cpeac202e733573-cmac202e733570.cpe.net.cable.rogers.com.51193: Flags [P.], seq 1496392:1496596, ack 181, win 501, length 204
17:04:05.075774 IP 167.99.180.39.ssh > cpeac202e733573-cmac202e733570.cpe.net.cable.rogers.com.51193: Flags [P.], seq 1496596:1496800, ack 181, win 501, length 204
17:04:05.075831 IP 167.99.180.39.ssh > cpeac202e733573-cmac202e733570.cpe.net.cable.rogers.com.51193: Flags [P.], seq 1496800:1497004, ack 181, win 501, length 204
17:04:05.075885 IP 167.99.180.39.ssh > cpeac202e733573-cmac202e733570.cpe.net.cable.rogers.com.51193: Flags [P.], seq 1497004:1497208, ack 181, win 501, length 204
17:04:05.075939 IP 167.99.180.39.ssh > cpeac202e733573-cmac202e733570.cpe.net.cable.rogers.com.51193: Flags [P.], seq 1497208:1497412, ack 181, win 501, length 204
17:04:05.075997 IP 167.99.180.39.ssh > cpeac202e733573-cmac202e733570.cpe.net.cable.rogers.com.51193: Flags [P.], seq 1497412:1497616, ack 181, win 501, length 204
17:04:05.076051 IP 167.99.180.39.ssh > cpeac202e733573-cmac202e733570.cpe.net.cable.rogers.com.51193: Flags [P.], seq 1497616:1497820, ack 181, win 501, length 204
17:04:05.076109 IP 167.99.180.39.ssh > cpeac202e733573-cmac202e733570.cpe.net.cable.rogers.com.51193: Flags [P.], seq 1497820:1498024, ack 181, win 501, length 204
17:04:05.076165 IP 167.99.180.39.ssh > cpeac202e733573-cmac202e733570.cpe.net.cable.rogers.com.51193: Flags [P.], seq 1498024:1498228, ack 181, win 501, length 204
17:04:05.076221 IP 167.99.180.39.ssh > cpeac202e733573-cmac202e733570.cpe.net.cable.rogers.com.51193: Flags [P.], seq 1498228:1498432, ack 181, win 501, length 204
17:04:05.076280 IP 167.99.180.39.ssh > cpeac202e733573-cmac202e733570.cpe.net.cable.rogers.com.51193: Flags [P.], seq 1498432:1498636, ack 181, win 501, length 204
17:04:05.076335 IP 167.99.180.39.ssh > cpeac202e733573-cmac202e733570.cpe.net.cable.rogers.com.51193: Flags [P.], seq 1498636:1498840, ack 181, win 501, length 204
17:04:05.076392 IP 167.99.180.39.ssh > cpeac202e733573-cmac202e733570.cpe.net.cable.rogers.com.51193: Flags [P.], seq 1498840:1499044, ack 181, win 501, length 204
17:04:05.076447 IP 167.99.180.39.ssh > cpeac202e733573-cmac202e733570.cpe.net.cable.rogers.com.51193: Flags [P.], seq 1499044:1499248, ack 181, win 501, length 204
17:04:05.076505 IP 167.99.180.39.ssh > cpeac202e733573-cmac202e733570.cpe.net.cable.rogers.com.51193: Flags [P.], seq 1499248:1499452, ack 181, win 501, length 204
17:04:05.076563 IP 167.99.180.39.ssh > cpeac202e733573-cmac202e733570.cpe.net.cable.rogers.com.51193: Flags [P.], seq 1499452:1499656, ack 181, win 501, length 204
17:04:05.076617 IP 167.99.180.39.ssh > cpeac202e733573-cmac202e733570.cpe.net.cable.rogers.com.51193: Flags [P.], seq 1499656:1499860, ack 181, win 501, length 204
17:04:05.076674 IP 167.99.180.39.ssh > cpeac202e733573-cmac202e733570.cpe.net.cable.rogers.com.51193: Flags [P.], seq 1499860:1500064, ack 181, win 501, length 204
17:04:05.076728 IP 167.99.180.39.ssh > cpeac202e733573-cmac202e733570.cpe.net.cable.rogers.com.51193: Flags [P.], seq 1500064:1500268, ack 181, win 501, length 204
17:04:05.076792 IP 167.99.180.39.ssh > cpeac202e733573-cmac202e733570.cpe.net.cable.rogers.com.51193: Flags [P.], seq 1500268:1500472, ack 181, win 501, length 204
17:04:05.076846 IP 167.99.180.39.ssh > cpeac202e733573-cmac202e733570.cpe.net.cable.rogers.com.51193: Flags [P.], seq 1500472:1500676, ack 181, win 501, length 204
17:04:05.076900 IP 167.99.180.39.ssh > cpeac202e733573-cmac202e733570.cpe.net.cable.rogers.com.51193: Flags [P.], seq 1500676:1500880, ack 181, win 501, length 204
17:04:05.076958 IP 167.99.180.39.ssh > cpeac202e733573-cmac202e733570.cpe.net.cable.rogers.com.51193: Flags [P.], seq 1500880:1501084, ack 181, win 501, length 204
17:04:05.077016 IP 167.99.180.39.ssh > cpeac202e733573-cmac202e733570.cpe.net.cable.rogers.com.51193: Flags [P.], seq 1501084:1501288, ack 181, win 501, length 204
17:04:05.077070 IP 167.99.180.39.ssh > cpeac202e733573-cmac202e733570.cpe.net.cable.rogers.com.51193: Flags [P.], seq 1501288:1501492, ack 181, win 501, length 204
17:04:05.077124 IP 167.99.180.39.ssh > cpeac202e733573-cmac202e733570.cpe.net.cable.rogers.com.51193: Flags [P.], seq 1501492:1501696, ack 181, win 501, length 204
17:04:05.077212 IP 167.99.180.39.ssh > cpeac202e733573-cmac202e733570.cpe.net.cable.rogers.com.51193: Flags [P.], seq 1501696:1501900, ack 181, win 501, length 204
17:04:05.077296 IP 167.99.180.39.ssh > cpeac202e733573-cmac202e733570.cpe.net.cable.rogers.com.51193: Flags [P.], seq 1501900:1502104, ack 181, win 501, length 204
17:04:05.077355 IP 167.99.180.39.ssh > cpeac202e733573-cmac202e733570.cpe.net.cable.rogers.com.51193: Flags [P.], seq 1502104:1502308, ack 181, win 501, length 204
17:04:05.077413 IP 167.99.180.39.ssh > cpeac202e733573-cmac202e733570.cpe.net.cable.rogers.com.51193: Flags [P.], seq 1502308:1502512, ack 181, win 501, length 204
17:04:05.077468 IP 167.99.180.39.ssh > cpeac202e733573-cmac202e733570.cpe.net.cable.rogers.com.51193: Flags [P.], seq 1502512:1502716, ack 181, win 501, length 204
17:04:05.077528 IP 167.99.180.39.ssh > cpeac202e733573-cmac202e733570.cpe.net.cable.rogers.com.51193: Flags [P.], seq 1502716:1502920, ack 181, win 501, length 204
17:04:05.077588 IP 167.99.180.39.ssh > cpeac202e733573-cmac202e733570.cpe.net.cable.rogers.com.51193: Flags [P.], seq 1502920:1503124, ack 181, win 501, length 204
17:04:05.077645 IP cpeac202e733573-cmac202e733570.cpe.net.cable.rogers.com.51193 > 167.99.180.39.ssh: Flags [.], ack 1463836, win 1033, length 0
17:04:05.077676 IP cpeac202e733573-cmac202e733570.cpe.net.cable.rogers.com.51193 > 167.99.180.39.ssh: Flags [.], ack 1466080, win 1025, length 0
17:04:05.077684 IP cpeac202e733573-cmac202e733570.cpe.net.cable.rogers.com.51193 > 167.99.180.39.ssh: Flags [P.], seq 181:253, ack 1466080, win 1025, length 72
^C
7577 packets captured
7579 packets received by filter
0 packets dropped by kernel