root@lamp-ubuntu-s-1vcpu-1gb-tor1-01:~# tcpdump -c 5 -i eth0
tcpdump: verbose output suppressed, use -v or -vv for full protocol decode
listening on eth0, link-type EN10MB (Ethernet), capture size 262144 bytes
16:56:13.701639 IP 167.99.180.39.ssh > cpeac202e733573-cmac202e733570.cpe.net.cable.rogers.com.51193: Flags [P.], seq 1607442306:1607442414, ack 2776234059, win 501, length 108
16:56:13.701705 IP 167.99.180.39.ssh > cpeac202e733573-cmac202e733570.cpe.net.cable.rogers.com.51193: Flags [P.], seq 108:144, ack 1, win 501, length 36
16:56:13.701749 IP 167.99.180.39.ssh > cpeac202e733573-cmac202e733570.cpe.net.cable.rogers.com.51193: Flags [P.], seq 144:252, ack 1, win 501, length 108
16:56:13.701798 IP 167.99.180.39.ssh > cpeac202e733573-cmac202e733570.cpe.net.cable.rogers.com.51193: Flags [P.], seq 252:288, ack 1, win 501, length 36
16:56:13.702265 IP 167.99.180.39.44898 > dns.google.domain: 47900+ PTR? 68.95.33.173.in-addr.arpa. (43)
5 packets captured
22 packets received by filter
0 packets dropped by kernel
root@lamp-ubuntu-s-1vcpu-1gb-tor1-01:~#