root@lamp-ubuntu-s-1vcpu-1gb-tor1-01:~# tcpdump -i eth0 port 22
03336:1103540, ack 181, win 501, length 204
17:04:35.396087 IP 167.99.180.39.ssh > cpeac202e733573-cmac202e733570.cpe.net.cable.rogers.com.51193: Flags [P.], seq 1103540:1103744, ack 181, win 501, length 204
17:04:35.396164 IP 167.99.180.39.ssh > cpeac202e733573-cmac202e733570.cpe.net.cable.rogers.com.51193: Flags [P.], seq 1103744:1103948, ack 181, win 501, length 204
17:04:35.396229 IP 167.99.180.39.ssh > cpeac202e733573-cmac202e733570.cpe.net.cable.rogers.com.51193: Flags [P.], seq 1103948:1104152, ack 181, win 501, length 204
17:04:35.396293 IP 167.99.180.39.ssh > cpeac202e733573-cmac202e733570.cpe.net.cable.rogers.com.51193: Flags [P.], seq 1104152:1104356, ack 181, win 501, length 204
17:04:35.396349 IP 167.99.180.39.ssh > cpeac202e733573-cmac202e733570.cpe.net.cable.rogers.com.51193: Flags [P.], seq 1104356:1104560, ack 181, win 501, length 204
17:04:35.396409 IP 167.99.180.39.ssh > cpeac202e733573-cmac202e733570.cpe.net.cable.rogers.com.51193: Flags [P.], seq 1104560:1104764, ack 181, win 501, length 204
17:04:35.396475 IP 167.99.180.39.ssh > cpeac202e733573-cmac202e733570.cpe.net.cable.rogers.com.51193: Flags [P.], seq 1104764:1104968, ack 181, win 501, length 204
17:04:35.396535 IP 167.99.180.39.ssh > cpeac202e733573-cmac202e733570.cpe.net.cable.rogers.com.51193: Flags [P.], seq 1104968:1105172, ack 181, win 501, length 204
17:04:35.396591 IP 167.99.180.39.ssh > cpeac202e733573-cmac202e733570.cpe.net.cable.rogers.com.51193: Flags [P.], seq 1105172:1105376, ack 181, win 501, length 204
17:04:35.396650 IP 167.99.180.39.ssh > cpeac202e733573-cmac202e733570.cpe.net.cable.rogers.com.51193: Flags [P.], seq 1105376:1105580, ack 181, win 501, length 204
17:04:35.396710 IP 167.99.180.39.ssh > cpeac202e733573-cmac202e733570.cpe.net.cable.rogers.com.51193: Flags [P.], seq 1105580:1105784, ack 181, win 501, length 204
17:04:35.396767 IP 167.99.180.39.ssh > cpeac202e733573-cmac202e733570.cpe.net.cable.rogers.com.51193: Flags [P.], seq 1105784:1105988, ack 181, win 501, length 204
17:04:35.396822 IP 167.99.180.39.ssh > cpeac202e733573-cmac202e733570.cpe.net.cable.rogers.com.51193: Flags [P.], seq 1105988:1106192, ack 181, win 501, length 204
17:04:35.396877 IP 167.99.180.39.ssh > cpeac202e733573-cmac202e733570.cpe.net.cable.rogers.com.51193: Flags [P.], seq 1106192:1106396, ack 181, win 501, length 204
17:04:35.396943 IP 167.99.180.39.ssh > cpeac202e733573-cmac202e733570.cpe.net.cable.rogers.com.51193: Flags [P.], seq 1106396:1106600, ack 181, win 501, length 204
17:04:35.397002 IP 167.99.180.39.ssh > cpeac202e733573-cmac202e733570.cpe.net.cable.rogers.com.51193: Flags [P.], seq 1106600:1106804, ack 181, win 501, length 204
17:04:35.397058 IP 167.99.180.39.ssh > cpeac202e733573-cmac202e733570.cpe.net.cable.rogers.com.51193: Flags [P.], seq 1106804:1107008, ack 181, win 501, length 204
17:04:35.397115 IP 167.99.180.39.ssh > cpeac202e733573-cmac202e733570.cpe.net.cable.rogers.com.51193: Flags [P.], seq 1107008:1107212, ack 181, win 501, length 204
17:04:35.397172 IP 167.99.180.39.ssh > cpeac202e733573-cmac202e733570.cpe.net.cable.rogers.com.51193: Flags [P.], seq 1107212:1107416, ack 181, win 501, length 204
17:04:35.397240 IP 167.99.180.39.ssh > cpeac202e733573-cmac202e733570.cpe.net.cable.rogers.com.51193: Flags [P.], seq 1107416:1107620, ack 181, win 501, length 204
17:04:35.397329 IP 167.99.180.39.ssh > cpeac202e733573-cmac202e733570.cpe.net.cable.rogers.com.51193: Flags [P.], seq 1107620:1107824, ack 181, win 501, length 204
17:04:35.397393 IP 167.99.180.39.ssh > cpeac202e733573-cmac202e733570.cpe.net.cable.rogers.com.51193: Flags [P.], seq 1107824:1108028, ack 181, win 501, length 204
17:04:35.397452 IP 167.99.180.39.ssh > cpeac202e733573-cmac202e733570.cpe.net.cable.rogers.com.51193: Flags [P.], seq 1108028:1108232, ack 181, win 501, length 204
17:04:35.397512 IP 167.99.180.39.ssh > cpeac202e733573-cmac202e733570.cpe.net.cable.rogers.com.51193: Flags [P.], seq 1108232:1108436, ack 181, win 501, length 204
17:04:35.397570 IP 167.99.180.39.ssh > cpeac202e733573-cmac202e733570.cpe.net.cable.rogers.com.51193: Flags [P.], seq 1108436:1108640, ack 181, win 501, length 204
17:04:35.397635 IP 167.99.180.39.ssh > cpeac202e733573-cmac202e733570.cpe.net.cable.rogers.com.51193: Flags [P.], seq 1108640:1108844, ack 181, win 501, length 204
17:04:35.397715 IP 167.99.180.39.ssh > cpeac202e733573-cmac202e733570.cpe.net.cable.rogers.com.51193: Flags [P.], seq 1108844:1109048, ack 181, win 501, length 204
17:04:35.397780 IP 167.99.180.39.ssh > cpeac202e733573-cmac202e733570.cpe.net.cable.rogers.com.51193: Flags [P.], seq 1109048:1109252, ack 181, win 501, length 204
17:04:35.397837 IP 167.99.180.39.ssh > cpeac202e733573-cmac202e733570.cpe.net.cable.rogers.com.51193: Flags [P.], seq 1109252:1109456, ack 181, win 501, length 204
17:04:35.397894 IP 167.99.180.39.ssh > cpeac202e733573-cmac202e733570.cpe.net.cable.rogers.com.51193: Flags [P.], seq 1109456:1109660, ack 181, win 501, length 204
17:04:35.397957 IP 167.99.180.39.ssh > cpeac202e733573-cmac202e733570.cpe.net.cable.rogers.com.51193: Flags [P.], seq 1109660:1109864, ack 181, win 501, length 204
17:04:35.398021 IP 167.99.180.39.ssh > cpeac202e733573-cmac202e733570.cpe.net.cable.rogers.com.51193: Flags [P.], seq 1109864:1110068, ack 181, win 501, length 204
17:04:35.398077 IP 167.99.180.39.ssh > cpeac202e733573-cmac202e733570.cpe.net.cable.rogers.com.51193: Flags [P.], seq 1110068:1110272, ack 181, win 501, length 204
17:04:35.398142 IP 167.99.180.39.ssh > cpeac202e733573-cmac202e733570.cpe.net.cable.rogers.com.51193: Flags [P.], seq 1110272:1110476, ack 181, win 501, length 204
17:04:35.398202 IP 167.99.180.39.ssh > cpeac202e733573-cmac202e733570.cpe.net.cable.rogers.com.51193: Flags [P.], seq 1110476:1110680, ack 181, win 501, length 204
17:04:35.398259 IP 167.99.180.39.ssh > cpeac202e733573-cmac202e733570.cpe.net.cable.rogers.com.51193: Flags [P.], seq 1110680:1110884, ack 181, win 501, length 204
17:04:35.398315 IP 167.99.180.39.ssh > cpeac202e733573-cmac202e733570.cpe.net.cable.rogers.com.51193: Flags [P.], seq 1110884:1111088, ack 181, win 501, length 204
17:04:35.398370 IP 167.99.180.39.ssh > cpeac202e733573-cmac202e733570.cpe.net.cable.rogers.com.51193: Flags [P.], seq 1111088:1111292, ack 181, win 501, length 204
17:04:35.398429 IP 167.99.180.39.ssh > cpeac202e733573-cmac202e733570.cpe.net.cable.rogers.com.51193: Flags [P.], seq 1111292:1111496, ack 181, win 501, length 204
17:04:35.398498 IP 167.99.180.39.ssh > cpeac202e733573-cmac202e733570.cpe.net.cable.rogers.com.51193: Flags [P.], seq 1111496:1111700, ack 181, win 501, length 204
17:04:35.398589 IP 167.99.180.39.ssh > cpeac202e733573-cmac202e733570.cpe.net.cable.rogers.com.51193: Flags [P.], seq 1111700:1111904, ack 181, win 501, length 204
17:04:35.398673 IP 167.99.180.39.ssh > cpeac202e733573-cmac202e733570.cpe.net.cable.rogers.com.51193: Flags [P.], seq 1111904:1112108, ack 181, win 501, length 204
17:04:35.398754 IP 167.99.180.39.ssh > cpeac202e733573-cmac202e733570.cpe.net.cable.rogers.com.51193: Flags [P.], seq 1112108:1112312, ack 181, win 501, length 204
17:04:35.398812 IP 167.99.180.39.ssh > cpeac202e733573-cmac202e733570.cpe.net.cable.rogers.com.51193: Flags [P.], seq 1112312:1112516, ack 181, win 501, length 204
17:04:35.398872 IP 167.99.180.39.ssh > cpeac202e733573-cmac202e733570.cpe.net.cable.rogers.com.51193: Flags [P.], seq 1112516:1112720, ack 181, win 501, length 204
17:04:35.398926 IP 167.99.180.39.ssh > cpeac202e733573-cmac202e733570.cpe.net.cable.rogers.com.51193: Flags [P.], seq 1112720:1112924, ack 181, win 501, length 204
17:04:35.398986 IP 167.99.180.39.ssh > cpeac202e733573-cmac202e733570.cpe.net.cable.rogers.com.51193: Flags [P.], seq 1112924:1113128, ack 181, win 501, length 204
17:04:35.399044 IP 167.99.180.39.ssh > cpeac202e733573-cmac202e733570.cpe.net.cable.rogers.com.51193: Flags [P.], seq 1113128:1113332, ack 181, win 501, length 204
17:04:35.399106 IP 167.99.180.39.ssh > cpeac202e733573-cmac202e733570.cpe.net.cable.rogers.com.51193: Flags [P.], seq 1113332:1113536, ack 181, win 501, length 204
17:04:35.399174 IP 167.99.180.39.ssh > cpeac202e733573-cmac202e733570.cpe.net.cable.rogers.com.51193: Flags [P.], seq 1113536:1113740, ack 181, win 501, length 204
17:04:35.399256 IP 167.99.180.39.ssh > cpeac202e733573-cmac202e733570.cpe.net.cable.rogers.com.51193: Flags [P.], seq 1113740:1113944, ack 181, win 501, length 204
17:04:35.399333 IP 167.99.180.39.ssh > cpeac202e733573-cmac202e733570.cpe.net.cable.rogers.com.51193: Flags [P.], seq 1113944:1114148, ack 181, win 501, length 204
17:04:35.399390 IP 167.99.180.39.ssh > cpeac202e733573-cmac202e733570.cpe.net.cable.rogers.com.51193: Flags [P.], seq 1114148:1114352, ack 181, win 501, length 204
17:04:35.399445 IP 167.99.180.39.ssh > cpeac202e733573-cmac202e733570.cpe.net.cable.rogers.com.51193: Flags [P.], seq 1114352:1114556, ack 181, win 501, length 204
17:04:35.399504 IP 167.99.180.39.ssh > cpeac202e733573-cmac202e733570.cpe.net.cable.rogers.com.51193: Flags [P.], seq 1114556:1114760, ack 181, win 501, length 204
17:04:35.399561 IP 167.99.180.39.ssh > cpeac202e733573-cmac202e733570.cpe.net.cable.rogers.com.51193: Flags [P.], seq 1114760:1114964, ack 181, win 501, length 204
17:04:35.399617 IP 167.99.180.39.ssh > cpeac202e733573-cmac202e733570.cpe.net.cable.rogers.com.51193: Flags [P.], seq 1114964:1115168, ack 181, win 501, length 204
17:04:35.399671 IP 167.99.180.39.ssh > cpeac202e733573-cmac202e733570.cpe.net.cable.rogers.com.51193: Flags [P.], seq 1115168:1115372, ack 181, win 501, length 204
17:04:35.399743 IP 167.99.180.39.ssh > cpeac202e733573-cmac202e733570.cpe.net.cable.rogers.com.51193: Flags [P.], seq 1115372:1115576, ack 181, win 501, length 204
17:04:35.399799 IP 167.99.180.39.ssh > cpeac202e733573-cmac202e733570.cpe.net.cable.rogers.com.51193: Flags [P.], seq 1115576:1115780, ack 181, win 501, length 204
17:04:35.399855 IP 167.99.180.39.ssh > cpeac202e733573-cmac202e733570.cpe.net.cable.rogers.com.51193: Flags [P.], seq 1115780:1115984, ack 181, win 501, length 204
17:04:35.399914 IP 167.99.180.39.ssh > cpeac202e733573-cmac202e733570.cpe.net.cable.rogers.com.51193: Flags [P.], seq 1115984:1116188, ack 181, win 501, length 204
17:04:35.399969 IP 167.99.180.39.ssh > cpeac202e733573-cmac202e733570.cpe.net.cable.rogers.com.51193: Flags [P.], seq 1116188:1116392, ack 181, win 501, length 204
17:04:35.400026 IP 167.99.180.39.ssh > cpeac202e733573-cmac202e733570.cpe.net.cable.rogers.com.51193: Flags [P.], seq 1116392:1116596, ack 181, win 501, length 204
17:04:35.400085 IP 167.99.180.39.ssh > cpeac202e733573-cmac202e733570.cpe.net.cable.rogers.com.51193: Flags [P.], seq 1116596:1116800, ack 181, win 501, length 204
17:04:35.400139 IP 167.99.180.39.ssh > cpeac202e733573-cmac202e733570.cpe.net.cable.rogers.com.51193: Flags [P.], seq 1116800:1117004, ack 181, win 501, length 204
17:04:35.400189 IP cpeac202e733573-cmac202e733570.cpe.net.cable.rogers.com.51193 > 167.99.180.39.ssh: Flags [.], ack 1056780, win 1211, length 0
17:04:35.400211 IP cpeac202e733573-cmac202e733570.cpe.net.cable.rogers.com.51193 > 167.99.180.39.ssh: Flags [.], ack 1057188, win 1209, length 0
17:04:35.400214 IP cpeac202e733573-cmac202e733570.cpe.net.cable.rogers.com.51193 > 167.99.180.39.ssh: Flags [.], ack 1061064, win 1194, length 0
17:04:35.400226 IP cpeac202e733573-cmac202e733570.cpe.net.cable.rogers.com.51193 > 167.99.180.39.ssh: Flags [.], ack 1063104, win 1186, length 0
17:04:35.400233 IP cpeac202e733573-cmac202e733570.cpe.net.cable.rogers.com.51193 > 167.99.180.39.ssh: Flags [.], ack 1064940, win 1179, length 0
17:04:35.400239 IP cpeac202e733573-cmac202e733570.cpe.net.cable.rogers.com.51193 > 167.99.180.39.ssh: Flags [.], ack 1070856, win 1156, length 0
17:04:35.400256 IP cpeac202e733573-cmac202e733570.cpe.net.cable.rogers.com.51193 > 167.99.180.39.ssh: Flags [.], ack 1071468, win 1153, length 0
17:04:35.400260 IP cpeac202e733573-cmac202e733570.cpe.net.cable.rogers.com.51193 > 167.99.180.39.ssh: Flags [.], ack 1076772, win 1132, length 0
17:04:35.400269 IP cpeac202e733573-cmac202e733570.cpe.net.cable.rogers.com.51193 > 167.99.180.39.ssh: Flags [.], ack 1078404, win 1126, length 0
17:04:35.400390 IP 167.99.180.39.ssh > cpeac202e733573-cmac202e733570.cpe.net.cable.rogers.com.51193: Flags [P.], seq 1117004:1118520, ack 181, win 501, length 1516
17:04:35.400456 IP 167.99.180.39.ssh > cpeac202e733573-cmac202e733570.cpe.net.cable.rogers.com.51193: Flags [P.], seq 1118520:1118724, ack 181, win 501, length 204
17:04:35.400516 IP 167.99.180.39.ssh > cpeac202e733573-cmac202e733570.cpe.net.cable.rogers.com.51193: Flags [P.], seq 1118724:1118928, ack 181, win 501, length 204
17:04:35.400575 IP 167.99.180.39.ssh > cpeac202e733573-cmac202e733570.cpe.net.cable.rogers.com.51193: Flags [P.], seq 1118928:1119132, ack 181, win 501, length 204
17:04:35.400633 IP 167.99.180.39.ssh > cpeac202e733573-cmac202e733570.cpe.net.cable.rogers.com.51193: Flags [P.], seq 1119132:1119336, ack 181, win 501, length 204
17:04:35.400690 IP 167.99.180.39.ssh > cpeac202e733573-cmac202e733570.cpe.net.cable.rogers.com.51193: Flags [P.], seq 1119336:1119540, ack 181, win 501, length 204
17:04:35.400748 IP 167.99.180.39.ssh > cpeac202e733573-cmac202e733570.cpe.net.cable.rogers.com.51193: Flags [P.], seq 1119540:1119744, ack 181, win 501, length 204
17:04:35.400804 IP 167.99.180.39.ssh > cpeac202e733573-cmac202e733570.cpe.net.cable.rogers.com.51193: Flags [P.], seq 1119744:1119948, ack 181, win 501, length 204
17:04:35.400860 IP 167.99.180.39.ssh > cpeac202e733573-cmac202e733570.cpe.net.cable.rogers.com.51193: Flags [P.], seq 1119948:1120152, ack 181, win 501, length 204
17:04:35.400918 IP 167.99.180.39.ssh > cpeac202e733573-cmac202e733570.cpe.net.cable.rogers.com.51193: Flags [P.], seq 1120152:1120356, ack 181, win 501, length 204
17:04:35.400973 IP 167.99.180.39.ssh > cpeac202e733573-cmac202e733570.cpe.net.cable.rogers.com.51193: Flags [P.], seq 1120356:1120560, ack 181, win 501, length 204
17:04:35.401029 IP 167.99.180.39.ssh > cpeac202e733573-cmac202e733570.cpe.net.cable.rogers.com.51193: Flags [P.], seq 1120560:1120764, ack 181, win 501, length 204
17:04:35.401087 IP 167.99.180.39.ssh > cpeac202e733573-cmac202e733570.cpe.net.cable.rogers.com.51193: Flags [P.], seq 1120764:1120968, ack 181, win 501, length 204
17:04:35.401142 IP 167.99.180.39.ssh > cpeac202e733573-cmac202e733570.cpe.net.cable.rogers.com.51193: Flags [P.], seq 1120968:1121172, ack 181, win 501, length 204
17:04:35.401266 IP 167.99.180.39.ssh > cpeac202e733573-cmac202e733570.cpe.net.cable.rogers.com.51193: Flags [P.], seq 1121172:1121376, ack 181, win 501, length 204
17:04:35.401355 IP 167.99.180.39.ssh > cpeac202e733573-cmac202e733570.cpe.net.cable.rogers.com.51193: Flags [P.], seq 1121376:1121580, ack 181, win 501, length 204
17:04:35.401416 IP 167.99.180.39.ssh > cpeac202e733573-cmac202e733570.cpe.net.cable.rogers.com.51193: Flags [P.], seq 1121580:1121784, ack 181, win 501, length 204
17:04:35.401473 IP 167.99.180.39.ssh > cpeac202e733573-cmac202e733570.cpe.net.cable.rogers.com.51193: Flags [P.], seq 1121784:1121988, ack 181, win 501, length 204
17:04:35.401530 IP 167.99.180.39.ssh > cpeac202e733573-cmac202e733570.cpe.net.cable.rogers.com.51193: Flags [P.], seq 1121988:1122192, ack 181, win 501, length 204
17:04:35.401590 IP 167.99.180.39.ssh > cpeac202e733573-cmac202e733570.cpe.net.cable.rogers.com.51193: Flags [P.], seq 1122192:1122396, ack 181, win 501, length 204
17:04:35.401649 IP 167.99.180.39.ssh > cpeac202e733573-cmac202e733570.cpe.net.cable.rogers.com.51193: Flags [P.], seq 1122396:1122600, ack 181, win 501, length 204
17:04:35.401706 IP 167.99.180.39.ssh > cpeac202e733573-cmac202e733570.cpe.net.cable.rogers.com.51193: Flags [P.], seq 1122600:1122804, ack 181, win 501, length 204
17:04:35.401762 IP 167.99.180.39.ssh > cpeac202e733573-cmac202e733570.cpe.net.cable.rogers.com.51193: Flags [P.], seq 1122804:1123008, ack 181, win 501, length 204
17:04:35.401818 IP 167.99.180.39.ssh > cpeac202e733573-cmac202e733570.cpe.net.cable.rogers.com.51193: Flags [P.], seq 1123008:1123212, ack 181, win 501, length 204
17:04:35.401879 IP 167.99.180.39.ssh > cpeac202e733573-cmac202e733570.cpe.net.cable.rogers.com.51193: Flags [P.], seq 1123212:1123416, ack 181, win 501, length 204
17:04:35.401957 IP 167.99.180.39.ssh > cpeac202e733573-cmac202e733570.cpe.net.cable.rogers.com.51193: Flags [P.], seq 1123416:1123620, ack 181, win 501, length 204
17:04:35.402061 IP 167.99.180.39.ssh > cpeac202e733573-cmac202e733570.cpe.net.cable.rogers.com.51193: Flags [P.], seq 1123620:1123824, ack 181, win 501, length 204
17:04:35.402151 IP 167.99.180.39.ssh > cpeac202e733573-cmac202e733570.cpe.net.cable.rogers.com.51193: Flags [P.], seq 1123824:1124028, ack 181, win 501, length 204
17:04:35.402241 IP 167.99.180.39.ssh > cpeac202e733573-cmac202e733570.cpe.net.cable.rogers.com.51193: Flags [P.], seq 1124028:1124232, ack 181, win 501, length 204
17:04:35.402336 IP 167.99.180.39.ssh > cpeac202e733573-cmac202e733570.cpe.net.cable.rogers.com.51193: Flags [P.], seq 1124232:1124436, ack 181, win 501, length 204
17:04:35.402431 IP 167.99.180.39.ssh > cpeac202e733573-cmac202e733570.cpe.net.cable.rogers.com.51193: Flags [P.], seq 1124436:1124640, ack 181, win 501, length 204
17:04:35.402522 IP 167.99.180.39.ssh > cpeac202e733573-cmac202e733570.cpe.net.cable.rogers.com.51193: Flags [P.], seq 1124640:1124844, ack 181, win 501, length 204
17:04:35.402632 IP 167.99.180.39.ssh > cpeac202e733573-cmac202e733570.cpe.net.cable.rogers.com.51193: Flags [P.], seq 1124844:1125048, ack 181, win 501, length 204
17:04:35.402754 IP 167.99.180.39.ssh > cpeac202e733573-cmac202e733570.cpe.net.cable.rogers.com.51193: Flags [P.], seq 1125048:1125252, ack 181, win 501, length 204
17:04:35.402825 IP 167.99.180.39.ssh > cpeac202e733573-cmac202e733570.cpe.net.cable.rogers.com.51193: Flags [P.], seq 1125252:1125456, ack 181, win 501, length 204
17:04:35.402887 IP 167.99.180.39.ssh > cpeac202e733573-cmac202e733570.cpe.net.cable.rogers.com.51193: Flags [P.], seq 1125456:1125660, ack 181, win 501, length 204
17:04:35.402947 IP 167.99.180.39.ssh > cpeac202e733573-cmac202e733570.cpe.net.cable.rogers.com.51193: Flags [P.], seq 1125660:1125864, ack 181, win 501, length 204
17:04:35.403005 IP 167.99.180.39.ssh > cpeac202e733573-cmac202e733570.cpe.net.cable.rogers.com.51193: Flags [P.], seq 1125864:1126068, ack 181, win 501, length 204
17:04:35.403059 IP 167.99.180.39.ssh > cpeac202e733573-cmac202e733570.cpe.net.cable.rogers.com.51193: Flags [P.], seq 1126068:1126272, ack 181, win 501, length 204
17:04:35.403117 IP 167.99.180.39.ssh > cpeac202e733573-cmac202e733570.cpe.net.cable.rogers.com.51193: Flags [P.], seq 1126272:1126476, ack 181, win 501, length 204
17:04:35.403173 IP 167.99.180.39.ssh > cpeac202e733573-cmac202e733570.cpe.net.cable.rogers.com.51193: Flags [P.], seq 1126476:1126680, ack 181, win 501, length 204
17:04:35.403232 IP 167.99.180.39.ssh > cpeac202e733573-cmac202e733570.cpe.net.cable.rogers.com.51193: Flags [P.], seq 1126680:1126884, ack 181, win 501, length 204
17:04:35.403287 IP 167.99.180.39.ssh > cpeac202e733573-cmac202e733570.cpe.net.cable.rogers.com.51193: Flags [P.], seq 1126884:1127088, ack 181, win 501, length 204
17:04:35.403342 IP 167.99.180.39.ssh > cpeac202e733573-cmac202e733570.cpe.net.cable.rogers.com.51193: Flags [P.], seq 1127088:1127292, ack 181, win 501, length 204
17:04:35.403402 IP 167.99.180.39.ssh > cpeac202e733573-cmac202e733570.cpe.net.cable.rogers.com.51193: Flags [P.], seq 1127292:1127496, ack 181, win 501, length 204
17:04:35.403458 IP 167.99.180.39.ssh > cpeac202e733573-cmac202e733570.cpe.net.cable.rogers.com.51193: Flags [P.], seq 1127496:1127700, ack 181, win 501, length 204
17:04:35.403518 IP 167.99.180.39.ssh > cpeac202e733573-cmac202e733570.cpe.net.cable.rogers.com.51193: Flags [P.], seq 1127700:1127904, ack 181, win 501, length 204
17:04:35.403573 IP 167.99.180.39.ssh > cpeac202e733573-cmac202e733570.cpe.net.cable.rogers.com.51193: Flags [P.], seq 1127904:1128108, ack 181, win 501, length 204
17:04:35.403628 IP 167.99.180.39.ssh > cpeac202e733573-cmac202e733570.cpe.net.cable.rogers.com.51193: Flags [P.], seq 1128108:1128312, ack 181, win 501, length 204
17:04:35.403686 IP 167.99.180.39.ssh > cpeac202e733573-cmac202e733570.cpe.net.cable.rogers.com.51193: Flags [P.], seq 1128312:1128516, ack 181, win 501, length 204
17:04:35.403741 IP 167.99.180.39.ssh > cpeac202e733573-cmac202e733570.cpe.net.cable.rogers.com.51193: Flags [P.], seq 1128516:1128720, ack 181, win 501, length 204
17:04:35.403799 IP 167.99.180.39.ssh > cpeac202e733573-cmac202e733570.cpe.net.cable.rogers.com.51193: Flags [P.], seq 1128720:1128924, ack 181, win 501, length 204
17:04:35.403855 IP 167.99.180.39.ssh > cpeac202e733573-cmac202e733570.cpe.net.cable.rogers.com.51193: Flags [P.], seq 1128924:1129128, ack 181, win 501, length 204
17:04:35.403913 IP 167.99.180.39.ssh > cpeac202e733573-cmac202e733570.cpe.net.cable.rogers.com.51193: Flags [P.], seq 1129128:1129332, ack 181, win 501, length 204
17:04:35.403970 IP 167.99.180.39.ssh > cpeac202e733573-cmac202e733570.cpe.net.cable.rogers.com.51193: Flags [P.], seq 1129332:1129536, ack 181, win 501, length 204
17:04:35.404027 IP 167.99.180.39.ssh > cpeac202e733573-cmac202e733570.cpe.net.cable.rogers.com.51193: Flags [P.], seq 1129536:1129740, ack 181, win 501, length 204
17:04:35.404121 IP 167.99.180.39.ssh > cpeac202e733573-cmac202e733570.cpe.net.cable.rogers.com.51193: Flags [P.], seq 1129740:1129944, ack 181, win 501, length 204
17:04:35.404206 IP 167.99.180.39.ssh > cpeac202e733573-cmac202e733570.cpe.net.cable.rogers.com.51193: Flags [P.], seq 1129944:1130148, ack 181, win 501, length 204
17:04:35.404269 IP 167.99.180.39.ssh > cpeac202e733573-cmac202e733570.cpe.net.cable.rogers.com.51193: Flags [P.], seq 1130148:1130352, ack 181, win 501, length 204
17:04:35.404328 IP 167.99.180.39.ssh > cpeac202e733573-cmac202e733570.cpe.net.cable.rogers.com.51193: Flags [P.], seq 1130352:1130556, ack 181, win 501, length 204
17:04:35.404386 IP 167.99.180.39.ssh > cpeac202e733573-cmac202e733570.cpe.net.cable.rogers.com.51193: Flags [P.], seq 1130556:1130760, ack 181, win 501, length 204
17:04:35.404445 IP 167.99.180.39.ssh > cpeac202e733573-cmac202e733570.cpe.net.cable.rogers.com.51193: Flags [P.], seq 1130760:1130964, ack 181, win 501, length 204
17:04:35.404504 IP 167.99.180.39.ssh > cpeac202e733573-cmac202e733570.cpe.net.cable.rogers.com.51193: Flags [P.], seq 1130964:1131168, ack 181, win 501, length 204
17:04:35.404559 IP 167.99.180.39.ssh > cpeac202e733573-cmac202e733570.cpe.net.cable.rogers.com.51193: Flags [P.], seq 1131168:1131372, ack 181, win 501, length 204
17:04:35.404617 IP 167.99.180.39.ssh > cpeac202e733573-cmac202e733570.cpe.net.cable.rogers.com.51193: Flags [P.], seq 1131372:1131576, ack 181, win 501, length 204
17:04:35.404677 IP 167.99.180.39.ssh > cpeac202e733573-cmac202e733570.cpe.net.cable.rogers.com.51193: Flags [P.], seq 1131576:1131780, ack 181, win 501, length 204
17:04:35.404734 IP 167.99.180.39.ssh > cpeac202e733573-cmac202e733570.cpe.net.cable.rogers.com.51193: Flags [P.], seq 1131780:1131984, ack 181, win 501, length 204
17:04:35.404790 IP 167.99.180.39.ssh > cpeac202e733573-cmac202e733570.cpe.net.cable.rogers.com.51193: Flags [P.], seq 1131984:1132188, ack 181, win 501, length 204
17:04:35.404845 IP 167.99.180.39.ssh > cpeac202e733573-cmac202e733570.cpe.net.cable.rogers.com.51193: Flags [P.], seq 1132188:1132392, ack 181, win 501, length 204
17:04:35.404904 IP 167.99.180.39.ssh > cpeac202e733573-cmac202e733570.cpe.net.cable.rogers.com.51193: Flags [P.], seq 1132392:1132596, ack 181, win 501, length 204
17:04:35.404959 IP 167.99.180.39.ssh > cpeac202e733573-cmac202e733570.cpe.net.cable.rogers.com.51193: Flags [P.], seq 1132596:1132800, ack 181, win 501, length 204
17:04:35.405017 IP 167.99.180.39.ssh > cpeac202e733573-cmac202e733570.cpe.net.cable.rogers.com.51193: Flags [P.], seq 1132800:1133004, ack 181, win 501, length 204
17:04:35.405074 IP 167.99.180.39.ssh > cpeac202e733573-cmac202e733570.cpe.net.cable.rogers.com.51193: Flags [P.], seq 1133004:1133208, ack 181, win 501, length 204
17:04:35.405133 IP 167.99.180.39.ssh > cpeac202e733573-cmac202e733570.cpe.net.cable.rogers.com.51193: Flags [P.], seq 1133208:1133412, ack 181, win 501, length 204
17:04:35.405213 IP 167.99.180.39.ssh > cpeac202e733573-cmac202e733570.cpe.net.cable.rogers.com.51193: Flags [P.], seq 1133412:1133616, ack 181, win 501, length 204
17:04:35.405306 IP 167.99.180.39.ssh > cpeac202e733573-cmac202e733570.cpe.net.cable.rogers.com.51193: Flags [P.], seq 1133616:1133820, ack 181, win 501, length 204
17:04:35.405373 IP 167.99.180.39.ssh > cpeac202e733573-cmac202e733570.cpe.net.cable.rogers.com.51193: Flags [P.], seq 1133820:1134024, ack 181, win 501, length 204
17:04:35.405432 IP 167.99.180.39.ssh > cpeac202e733573-cmac202e733570.cpe.net.cable.rogers.com.51193: Flags [P.], seq 1134024:1134228, ack 181, win 501, length 204
17:04:35.405487 IP 167.99.180.39.ssh > cpeac202e733573-cmac202e733570.cpe.net.cable.rogers.com.51193: Flags [P.], seq 1134228:1134432, ack 181, win 501, length 204
17:04:35.405541 IP 167.99.180.39.ssh > cpeac202e733573-cmac202e733570.cpe.net.cable.rogers.com.51193: Flags [P.], seq 1134432:1134636, ack 181, win 501, length 204
17:04:35.405577 IP cpeac202e733573-cmac202e733570.cpe.net.cable.rogers.com.51193 > 167.99.180.39.ssh: Flags [P.], seq 181:217, ack 1078404, win 1126, length 36
17:04:35.405591 IP cpeac202e733573-cmac202e733570.cpe.net.cable.rogers.com.51193 > 167.99.180.39.ssh: Flags [.], ack 1079016, win 1124, length 0
17:04:35.405599 IP cpeac202e733573-cmac202e733570.cpe.net.cable.rogers.com.51193 > 167.99.180.39.ssh: Flags [.], ack 1081056, win 1116, length 0
17:04:35.405607 IP cpeac202e733573-cmac202e733570.cpe.net.cable.rogers.com.51193 > 167.99.180.39.ssh: Flags [.], ack 1081872, win 1113, length 0
17:04:35.405613 IP cpeac202e733573-cmac202e733570.cpe.net.cable.rogers.com.51193 > 167.99.180.39.ssh: Flags [.], ack 1082280, win 1111, length 0
17:04:35.405616 IP cpeac202e733573-cmac202e733570.cpe.net.cable.rogers.com.51193 > 167.99.180.39.ssh: Flags [.], ack 1084116, win 1104, length 0
17:04:35.405622 IP cpeac202e733573-cmac202e733570.cpe.net.cable.rogers.com.51193 > 167.99.180.39.ssh: Flags [.], ack 1084728, win 1101, length 0
17:04:35.405625 IP cpeac202e733573-cmac202e733570.cpe.net.cable.rogers.com.51193 > 167.99.180.39.ssh: Flags [.], ack 1085544, win 1098, length 0
17:04:35.405629 IP cpeac202e733573-cmac202e733570.cpe.net.cable.rogers.com.51193 > 167.99.180.39.ssh: Flags [.], ack 1086564, win 1094, length 0
17:04:35.405634 IP cpeac202e733573-cmac202e733570.cpe.net.cable.rogers.com.51193 > 167.99.180.39.ssh: Flags [.], ack 1086972, win 1093, length 0
17:04:35.405637 IP cpeac202e733573-cmac202e733570.cpe.net.cable.rogers.com.51193 > 167.99.180.39.ssh: Flags [.], ack 1087380, win 1091, length 0
17:04:35.405640 IP cpeac202e733573-cmac202e733570.cpe.net.cable.rogers.com.51193 > 167.99.180.39.ssh: Flags [.], ack 1088196, win 1088, length 0
17:04:35.405644 IP cpeac202e733573-cmac202e733570.cpe.net.cable.rogers.com.51193 > 167.99.180.39.ssh: Flags [.], ack 1089216, win 1084, length 0
17:04:35.405648 IP cpeac202e733573-cmac202e733570.cpe.net.cable.rogers.com.51193 > 167.99.180.39.ssh: Flags [.], ack 1089624, win 1082, length 0
17:04:35.405651 IP cpeac202e733573-cmac202e733570.cpe.net.cable.rogers.com.51193 > 167.99.180.39.ssh: Flags [.], ack 1090236, win 1080, length 0
17:04:35.405654 IP cpeac202e733573-cmac202e733570.cpe.net.cable.rogers.com.51193 > 167.99.180.39.ssh: Flags [.], ack 1091256, win 1076, length 0
17:04:35.405658 IP cpeac202e733573-cmac202e733570.cpe.net.cable.rogers.com.51193 > 167.99.180.39.ssh: Flags [.], ack 1092276, win 1072, length 0
17:04:35.405662 IP cpeac202e733573-cmac202e733570.cpe.net.cable.rogers.com.51193 > 167.99.180.39.ssh: Flags [.], ack 1092684, win 1070, length 0
17:04:35.405665 IP cpeac202e733573-cmac202e733570.cpe.net.cable.rogers.com.51193 > 167.99.180.39.ssh: Flags [.], ack 1103336, win 1029, length 0
17:04:35.405690 IP cpeac202e733573-cmac202e733570.cpe.net.cable.rogers.com.51193 > 167.99.180.39.ssh: Flags [.], ack 1107620, win 1012, length 0
^C
5811 packets captured
5811 packets received by filter
0 packets dropped by kernel