root@lamp-ubuntu-s-1vcpu-1gb-tor1-01:~# tcpdump -n -i eth0
17:03:27.157607 IP 167.99.180.39.22 > 173.33.95.68.51193: Flags [P.], seq 907576:907732, ack 181, win 501, length 156
17:03:27.157670 IP 167.99.180.39.22 > 173.33.95.68.51193: Flags [P.], seq 907732:907888, ack 181, win 501, length 156
17:03:27.157728 IP 167.99.180.39.22 > 173.33.95.68.51193: Flags [P.], seq 907888:908044, ack 181, win 501, length 156
17:03:27.157782 IP 167.99.180.39.22 > 173.33.95.68.51193: Flags [P.], seq 908044:908200, ack 181, win 501, length 156
17:03:27.157837 IP 167.99.180.39.22 > 173.33.95.68.51193: Flags [P.], seq 908200:908356, ack 181, win 501, length 156
17:03:27.157919 IP 167.99.180.39.22 > 173.33.95.68.51193: Flags [P.], seq 908356:908512, ack 181, win 501, length 156
17:03:27.157979 IP 167.99.180.39.22 > 173.33.95.68.51193: Flags [P.], seq 908512:908668, ack 181, win 501, length 156
17:03:27.158034 IP 167.99.180.39.22 > 173.33.95.68.51193: Flags [P.], seq 908668:908824, ack 181, win 501, length 156
17:03:27.158090 IP 167.99.180.39.22 > 173.33.95.68.51193: Flags [P.], seq 908824:908980, ack 181, win 501, length 156
17:03:27.158203 IP 167.99.180.39.22 > 173.33.95.68.51193: Flags [P.], seq 908980:909136, ack 181, win 501, length 156
17:03:27.158290 IP 167.99.180.39.22 > 173.33.95.68.51193: Flags [P.], seq 909136:909292, ack 181, win 501, length 156
17:03:27.158366 IP 167.99.180.39.22 > 173.33.95.68.51193: Flags [P.], seq 909292:909448, ack 181, win 501, length 156
17:03:27.158451 IP 167.99.180.39.22 > 173.33.95.68.51193: Flags [P.], seq 909448:909604, ack 181, win 501, length 156
17:03:27.158524 IP 167.99.180.39.22 > 173.33.95.68.51193: Flags [P.], seq 909604:909760, ack 181, win 501, length 156
17:03:27.158609 IP 167.99.180.39.22 > 173.33.95.68.51193: Flags [P.], seq 909760:909916, ack 181, win 501, length 156
17:03:27.158680 IP 167.99.180.39.22 > 173.33.95.68.51193: Flags [P.], seq 909916:910072, ack 181, win 501, length 156
17:03:27.158756 IP 167.99.180.39.22 > 173.33.95.68.51193: Flags [P.], seq 910072:910228, ack 181, win 501, length 156
17:03:27.158817 IP 167.99.180.39.22 > 173.33.95.68.51193: Flags [P.], seq 910228:910384, ack 181, win 501, length 156
17:03:27.158874 IP 167.99.180.39.22 > 173.33.95.68.51193: Flags [P.], seq 910384:910540, ack 181, win 501, length 156
17:03:27.158930 IP 167.99.180.39.22 > 173.33.95.68.51193: Flags [P.], seq 910540:910696, ack 181, win 501, length 156
17:03:27.158986 IP 167.99.180.39.22 > 173.33.95.68.51193: Flags [P.], seq 910696:910852, ack 181, win 501, length 156
17:03:27.159041 IP 167.99.180.39.22 > 173.33.95.68.51193: Flags [P.], seq 910852:911008, ack 181, win 501, length 156
17:03:27.159100 IP 167.99.180.39.22 > 173.33.95.68.51193: Flags [P.], seq 911008:911164, ack 181, win 501, length 156
17:03:27.159154 IP 167.99.180.39.22 > 173.33.95.68.51193: Flags [P.], seq 911164:911320, ack 181, win 501, length 156
17:03:27.159214 IP 173.33.95.68.51193 > 167.99.180.39.22: Flags [P.], seq 181:253, ack 863180, win 2721, length 72
^C
5955 packets captured
5958 packets received by filter
0 packets dropped by kernel